{
  "contractVersion": "1.0.0",
  "sessionId": "6f1c2a8e-3b7d-4c55-9a0e-1d2f4b6c8e10",
  "simulationId": "football.coverage.read.v1",
  "simulationVersion": "1.0.0",
  "completed": true,
  "aborted": false,
  "durationMs": 168000,
  "score": 82,
  "accuracy": 0.67,
  "outcomes": [
    { "id": "round-1", "success": true, "label": "Read Cover 3 and hit the seam", "value": "cover-3" },
    { "id": "round-2", "success": true, "label": "Spotted man coverage from the motion", "value": "man" },
    { "id": "round-3", "success": false, "label": "Missed the Cover 2 hole", "value": "cover-2" }
  ],
  "mistakes": [
    { "conceptId": "cover-2", "description": "Threw to the corner route into the safety's zone instead of the hole between corner and safety.", "at": 141200 }
  ],
  "masterySignals": [
    { "conceptId": "cover-3", "delta": 0.25, "evidence": "Correctly identified three-deep shell in round 1." },
    { "conceptId": "zone-vs-man", "delta": 0.15, "evidence": "Distinguished man from zone using pre-snap motion." },
    { "conceptId": "cover-2", "delta": -0.1, "evidence": "Misread two-deep shell in round 3." }
  ],
  "xpEarned": 40,
  "heartsLost": 1,
  "replayAvailable": true,
  "telemetry": { "avgFps": 59.4, "p5Fps": 55.0, "loadTimeMs": 1450, "peakMemoryMb": 118.5, "unityVersion": "6000.3.24f1", "gameKitVersion": "1.0.0" }
}
